{
  "$schema": "https://json-schema.org/draft/2020-12/schema",
  "$id": "https://daily-bible-reader.local/schemas/commentary.schema.json",
  "title": "Layered commentary synthesis",
  "type": "object",
  "required": [
    "schemaVersion",
    "commentaryVersion",
    "readingId",
    "publicationStatus",
    "dailyIntroduction",
    "commentarySummary",
    "practicalTakeaway",
    "overview",
    "claims",
    "sourceNotes",
    "coverage",
    "generation"
  ],
  "properties": {
    "schemaVersion": {"enum": ["commentary/v2", "commentary/v3"]},
    "commentaryVersion": {"type": "string", "minLength": 1, "maxLength": 80},
    "readingId": {"type": "string", "pattern": "^[A-Za-z0-9][A-Za-z0-9_-]{1,79}$"},
    "publicationStatus": {"enum": ["placeholder", "draft", "reviewed", "published"]},
    "dailyIntroduction": {
      "type": "object",
      "required": ["markdown", "sourceIds"],
      "properties": {
        "markdown": {"type": "string", "minLength": 1, "maxLength": 3000},
        "sourceIds": {"type": "array", "items": {"type": "string"}, "uniqueItems": true}
      },
      "additionalProperties": false
    },
    "commentarySummary": {
      "type": "object",
      "required": ["paragraphs"],
      "properties": {
        "paragraphs": {
          "type": "array",
          "maxItems": 12,
          "items": {
            "type": "object",
            "required": ["markdown", "sourceIds"],
            "properties": {
              "markdown": {
                "type": "string",
                "minLength": 1,
                "maxLength": 4000,
                "description": "One paragraph in the coherent executive synthesis. In commentary/v3, retain {{cite:source_id,source_id}} after supported claims as private provenance; the daily surface omits these markers and links readers to the separate detailed synthesis for claim-level citations."
              },
              "sourceIds": {"type": "array", "items": {"type": "string"}, "uniqueItems": true}
            },
            "additionalProperties": false
          }
        }
      },
      "additionalProperties": false
    },
    "practicalTakeaway": {
      "type": "object",
      "required": ["markdown", "sourceIds"],
      "properties": {
        "markdown": {"type": "string", "minLength": 1, "maxLength": 600},
        "sourceIds": {"type": "array", "items": {"type": "string"}, "uniqueItems": true}
      },
      "additionalProperties": false
    },
    "verseOfTheDay": {
      "type": "object",
      "required": ["bookId", "chapter", "verse"],
      "properties": {
        "bookId": {"type": "string", "pattern": "^[A-Z0-9]{2,5}$"},
        "chapter": {"type": "integer", "minimum": 1, "maximum": 200},
        "verse": {"type": "integer", "minimum": 1, "maximum": 200}
      },
      "additionalProperties": false,
      "description": "Editorial selection only. Store the reference, never ESV wording; the client derives the exact text from the live provider response."
    },
    "verseCommentary": {
      "$ref": "mhc-runtime.schema.json#/$defs/chapterShard",
      "description": "Optional precomputed private chapter shard. The browser performs local verse lookup with no runtime AI call; a reviewed shard may include only the exact cited public-domain commentary atoms used by its condensations."
    },
    "verseCommentaries": {
      "type": "array",
      "minItems": 1,
      "maxItems": 5,
      "items": {"$ref": "mhc-runtime.schema.json#/$defs/chapterShard"},
      "description": "Precomputed private chapter shards for a multi-chapter daily reading, in configured passage order. Use verseCommentary for legacy one-chapter records."
    },
    "henrySourceLink": {
      "type": "object",
      "required": ["sourceId", "title", "url", "note"],
      "properties": {
        "sourceId": {"type": "string", "minLength": 1, "maxLength": 200},
        "title": {"type": "string", "minLength": 1, "maxLength": 200},
        "url": {"type": "string", "pattern": "^https://", "maxLength": 1000},
        "note": {"type": "string", "minLength": 1, "maxLength": 500}
      },
      "additionalProperties": false,
      "description": "Optional verified full-text public-domain link used when a reviewed condensed Henry shard is unavailable. It contains no copied source text and must resolve to a registered source."
    },
    "bookCommentary": {
      "$ref": "mhc-runtime.schema.json#/$defs/bookIntroShard",
      "description": "Optional precomputed private book-level resource; never represented as a fabricated verse."
    },
    "overview": {"type": "string", "minLength": 1, "maxLength": 12000},
    "sections": {
      "type": "array",
      "minItems": 12,
      "items": {
        "type": "object",
        "required": ["sectionId", "title", "markdown", "sourceIds"],
        "properties": {
          "sectionId": {"type": "string", "pattern": "^[a-z0-9][a-z0-9-]{1,79}$"},
          "title": {"type": "string", "minLength": 1, "maxLength": 200},
          "markdown": {"type": "string", "minLength": 1, "maxLength": 100000},
          "sourceIds": {"type": "array", "items": {"type": "string"}, "uniqueItems": true}
        },
        "additionalProperties": false
      }
    },
    "comprehensiveSynthesis": {
      "type": "object",
      "required": ["markdown", "sourceIds"],
      "properties": {
        "markdown": {"type": "string", "minLength": 1, "maxLength": 300000},
        "sourceIds": {"type": "array", "items": {"type": "string"}, "uniqueItems": true}
      },
      "additionalProperties": false
    },
    "claims": {
      "type": "array",
      "items": {
        "type": "object",
        "required": ["claimId", "text", "sourceIds", "confidence", "singleSource"],
        "properties": {
          "claimId": {"type": "string", "pattern": "^[A-Za-z0-9][A-Za-z0-9_-]{1,99}$"},
          "text": {"type": "string", "minLength": 1, "maxLength": 4000},
          "sourceIds": {"type": "array", "minItems": 1, "items": {"type": "string"}, "uniqueItems": true},
          "confidence": {"enum": ["high", "medium", "low"]},
          "singleSource": {"type": "boolean"}
        },
        "additionalProperties": false
      }
    },
    "sourceNotes": {"type": "array", "items": {"type": "string", "maxLength": 4000}},
    "coverage": {
      "type": "object",
      "required": ["representedCategories", "missingCategories", "consultedCount", "includedCount", "majorDisagreements", "singleSourceClaimIds", "inaccessibleSourceIds", "limitations"],
      "properties": {
        "representedCategories": {"type": "array", "items": {"type": "string"}, "uniqueItems": true},
        "missingCategories": {"type": "array", "items": {"type": "string"}, "uniqueItems": true},
        "consultedCount": {"type": "integer", "minimum": 0},
        "includedCount": {"type": "integer", "minimum": 0},
        "majorDisagreements": {"type": "array", "items": {"type": "string", "maxLength": 4000}},
        "singleSourceClaimIds": {"type": "array", "items": {"type": "string"}, "uniqueItems": true},
        "inaccessibleSourceIds": {"type": "array", "items": {"type": "string"}, "uniqueItems": true},
        "limitations": {"type": "array", "items": {"type": "string", "maxLength": 4000}}
      },
      "additionalProperties": false
    },
    "componentAssessments": {
      "type": "object",
      "properties": {
        "historicalContext": {
          "type": "object",
          "required": ["status"],
          "properties": {
            "status": {"enum": ["included", "not_material"]},
            "rationale": {"type": "string", "minLength": 1, "maxLength": 2000}
          },
          "allOf": [
            {
              "if": {"properties": {"status": {"const": "not_material"}}, "required": ["status"]},
              "then": {"required": ["rationale"]}
            }
          ],
          "additionalProperties": false,
          "description": "Optional for legacy readability. Current protocol readiness requires this assessment and validates it against the exact comprehensive-synthesis context headings."
        }
      },
      "additionalProperties": false
    },
    "generation": {
      "type": "object",
      "required": ["generatedAt", "modelOrTool", "promptOrWorkflowVersion", "sourceSetVersion", "humanReviewStatus", "contentHash", "priorVersions", "knownLimitations"],
      "properties": {
        "generatedAt": {"type": ["string", "null"], "format": "date-time"},
        "modelOrTool": {"type": ["string", "null"], "maxLength": 300},
        "promptOrWorkflowVersion": {"type": "string", "minLength": 1, "maxLength": 100},
        "contentProtocolVersion": {"type": "string", "minLength": 1, "maxLength": 100, "description": "Optional for legacy readability. Current protocol readiness requires the exact canonical daily-study protocol version."},
        "sourceSetVersion": {"type": "string", "minLength": 1, "maxLength": 100},
        "humanReviewStatus": {"enum": ["not_started", "unreviewed", "in_review", "approved", "changes_requested"]},
        "contentHash": {"type": ["string", "null"], "pattern": "^[a-f0-9]{64}$"},
        "priorVersions": {"type": "array", "items": {"type": "string"}, "uniqueItems": true},
        "knownLimitations": {"type": "array", "items": {"type": "string", "maxLength": 4000}}
      },
      "additionalProperties": false
    }
  },
  "allOf": [
    {
      "if": {
        "properties": {"schemaVersion": {"const": "commentary/v2"}},
        "required": ["schemaVersion"]
      },
      "then": {
        "required": ["sections"],
        "not": {"required": ["comprehensiveSynthesis"]}
      }
    },
    {
      "if": {
        "properties": {"schemaVersion": {"const": "commentary/v3"}},
        "required": ["schemaVersion"]
      },
      "then": {
        "required": ["comprehensiveSynthesis"],
        "not": {"required": ["sections"]}
      }
    }
  ],
  "additionalProperties": false
}
